Title,Description,Price,ImageURL,SKU,Category,Stock
Wireless Bluetooth Headphones,High-quality wireless headphones with noise cancellation and long battery life,1299,https://images.unsplash.com/photo-1505740420928-5e560c06d30e?w=300&h=300&fit=crop,WH001,electronics,50
Casual Cotton T-Shirt,Comfortable cotton t-shirt for everyday wear with breathable fabric,599,https://images.unsplash.com/photo-1521572163474-6864f9cf17ab?w=300&h=300&fit=crop,TS001,clothing,100
Smartphone Protective Case,Durable protective case for smartphones with shock absorption,299,https://images.unsplash.com/photo-1603313011108-4f2d0b3b0b0b?w=300&h=300&fit=crop,SC001,electronics,75
Professional Running Shoes,Comfortable running shoes for athletes with superior cushioning,2499,https://images.unsplash.com/photo-1542291026-7eec264c27ff?w=300&h=300&fit=crop,RS001,sports,30
Kitchen Stand Mixer,Professional kitchen mixer for baking with multiple attachments,3999,https://images.unsplash.com/photo-1556909114-f6e7ad7d3136?w=300&h=300&fit=crop,KM001,home,20
